File_Name,Text_Content,Annotator_1,Annotator_2,Annotator_3
BBCNews_46,"Greece has become the first Christian Orthodox-majority country to legalise same-sex marriage. Same-sex couples will now also be legally allowed to adopt children after Thursday's 176-76 vote in parliament. Prime Minister Kyriakos Mitsotakis said the new law would ""boldly abolish a serious inequality"". But it has divided the country, with fierce resistance led by the powerful Orthodox Church. Its supporters held a protest rally in Athens. Many displayed banners, held crosses, read prayers and sang passages from the Bible in the capital's Syntagma Square. The head of the Orthodox Church, Archbishop Ieronymos, said the measure would ""corrupt the homeland's social cohesion"". The bill needed a simple majority to pass through the 300-member parliament. Mr Mitsotakis had championed the bill but required the support of opposition parties to get it over the line, with dozens of MPs from his centre-right governing party opposed.  ""People who have been invisible will finally be made visible around us, and with them, many children will finally find their rightful place,"" the prime minister told parliament during a debate ahead of the vote.  ""The reform makes the lives of several of our fellow citizens better, without taking away anything from the lives of the many."" The vote has been welcomed by LGBTQ organisations in Greece. ""This is a historic moment,"" Stella Belia, the head of same-sex parents' group Rainbow Families, told Reuters news agency. ""This is a day of joy.""  Fifteen of the European Union's 27 members have already legalised same-sex marriage. It is permitted in 35 countries worldwide. Greece has until now lagged behind some of its European neighbours, largely because of opposition from the Church.  It is the first country in south-eastern Europe to have marriage equality. The pop star talks about her sex-positive EP, and why artists need to take a stand over royalties. It is America's first federal trial over an an alleged hate crime based on gender identity. First broadcast 25 years ago, Queer as Folk depicted three gay men in a way not seen on TV before. The General Medical Council is ""truly sorry' for past prejudices that ended some gay doctors' careers. Newcastle's Gay Village and London's Chinatown feature in projects exploring working class heritage. Copyright 2024 BBC. All rights reserved.  The BBC is not responsible for the content of external sites. Read about our approach to external linking.  ",0,0,
BBCNews_47," The Daily Telegraph reports that the Health Secretary, Victoria Atkins, has indicated she would back decriminalising abortion after 24 weeks, one of two amendments to the law that MPs are due to vote on next month.  She has told the paper her voting record - on decriminalisation - speaks for itself, though she insists she will not pronounce publicly on the issue, so as not to influence MPs, who it is understood will be given a free vote.  The other amendment calls for a reduction of the legal time limit for abortion, from 24 weeks to 22. The Times, in an editorial, marks the two-year anniversary of the start of the war in Ukraine.  It urges western allies to give more weapons to Kyiv, or face the possibility of a humiliating defeat for Ukraine - and the West - in the third year of the war.  It is a point Boris Johnson also makes in the Daily Mail.  He argues that if Ukraine was given enough of the right weapons - particularly cruise missiles and shells - it could begin to make serious attacks on Crimea, which the former prime minister sees as vulnerable, and key to winning the war. The i newspaper says it has been told the UK is offering Russian officials British passports to defect and pass secrets to MI6.  British intelligence sources and a Russian informant said disgruntled members of Vladimir Putin's regime are being offered a new life in Britain if they will share information.  The Guardian carries criticism of the Conservative MP, Lee Anderson, for his suggestion on GB News that the Mayor of London, Sadiq Khan, had given the city away to Islamists.  It quotes the shadow exports minister, Tan Dhesi, as saying the remarks were deplorable, given the current rise in cases of Islamophobia and antisemitism.  The Times says that a leading pro-Palestinian activist wanted to create a protest that made Parliament, ""have to lock its doors"" amid concerns about MPs' safety.  According to the Daily Express, Esther Rantzen's campaign to force a vote on assisted dying has taken a step forward, with the government saying it would allow MPs to decide on changing the law. The veteran activist has stage-four cancer, and wants to die without pain. The Telegraph reports that the Ministry of Defence has been accused of ""betrayal"" because of a plan to change the rules on military accommodation. From next month, for the first time, the size of living quarters allocated to service personnel will depend on the number of people in their family, not their rank, with more senior officers traditionally receiving larger homes.   The paper says a petition organised by army wives calling for a review of the policy has received 16,000 signatures. And the Times, Telegraph and Express all feature photos of a smiling King, at a table at Buckingham Palace, reading some of the 7,000 cards he was sent after his cancer diagnosis. So too does the Daily Mirror which says the cards have lifted his spirits. Its headline... King and Tonic. Sign up for our morning newsletter and get BBC News in your inbox. Copyright 2024 BBC. All rights reserved.  The BBC is not responsible for the content of external sites. Read about our approach to external linking.  ",6,7,
BBCNews_48,"Ministers have been accused of kicking plans for protest buffer zones around abortion clinics ""into the long grass"", after it was announced they would not be implemented until next spring. A law to introduce buffer zones in England and Wales was passed in May. But the government said it was launching a consultation on guidance before buffer zones could be enforced. The British Pregnancy Advisory Service (BPAS) said it was ""disappointed but not surprised"" by the delay. The charity is the leading provider of abortion advice and treatment in the UK, with more than 55 reproductive healthcare clinics across the country.  Rachael Clarke, chief of staff at BPAS, told the BBC: ""It seems like all they are doing is once again kicking it into the long grass. And in the meantime women are going to continue to suffer."" Buffer zones would prevent demonstrations within 150 metres of an abortion clinic.  Ms Clarke said that since the law was passed more than six months ago, protests had continued ""unabated"", with at least 16 clinics targeted. BPAS said examples included a man protesting in a waiting room and refusing to leave and individuals standing outside a clinic with graphic signs showing foetuses.  Ms Clarke argued there was no need for guidance or a consultation as the law was closely worded with similar measures already implemented in Northern Ireland, which the Supreme Court ruled did not ""disproportionately interfere"" with protesters' rights. She added that she was concerned guidance could weaken protections for women, for example by allowing ""peaceful prayer"" outside clinics, which she said caused ""the vast majority of distress, alarm and harassment"".  On Monday, Home Office minister Lord Sharpe told peers: ""The government will issue non-statutory guidance to ensure law enforcement agencies have a clear, consistent understanding around enforcement, and abortion service providers and protesters are clear as to what is expected under the new law."" He said a consultation on the guidance would be launched ""imminently"" to ensure the legislation could be implemented effectively from spring next year. Lord Sharpe added: ""This is new legislation on an emotive topic and there are strong views on all sides of the debate, and determining the appropriate balance will not always be straightforward."" However, Labour MP Stella Creasy, who first proposed the measures to introduce buffer zones, said launching a consultation was ""a stalling tactic"".  ""A woman's right to access an abortion in peace without being harassed should be straightforward - Parliament voted for it,"" she said. ""And yet we can see the government putting up hurdles."" She said buffer zones had already undergone scrutiny before the law was passed and guidance was available on Public Spaces Protection Orders, which allow councils to prohibit specified activities within a defined area.  Some councils have already used such orders to introduce local buffer zones around abortion clinics. But campaigners says this can take a significant amount of time and money to introduce and have called for a nation-wide solution. Christian Concern, which is involved in a legal challenge against a buffer zone around an abortion clinic in Bournemouth, said it welcomed the consultation.  Chief executive Andrea Williams said: ""Buffer zones set a dangerous precedent and are being weaponised to silence debate and prevent women accessing any alternatives to abortion."" Under section 9 of the Public Order Act, which was passed in May, harassing, obstructing or interfering with anyone attending an abortion clinic, within a 150 metre ""safe access zone"", was made a criminal offence carrying an unlimited fine. The measure had cross-party support, although it was opposed by some senior politicians including Minister for Women and Equalities Kemi Badenoch and then-Home Secretary Suella Braverman.  A similar bill has also been published in Scotland but it has not yet become law.  The victims were killed in separate, unrelated incidents in the Austrian capital on Friday. The dress is included in an exhibition at Leeds' Thackray Museum of Medicine. Data shows half of the referrals in 2023 resulted in no treatment. Women take part despite some in the community suggesting it should remain a men-only event. Plans for the doctors' regulator to license less-qualified health workers are under attack. Copyright 2024 BBC. All rights reserved.  The BBC is not responsible for the content of external sites. Read about our approach to external linking.  ",3,3,
BBCNews_49,"Adopters are needed to ensure brothers and sisters in South Yorkshire are able to stay together. One Adoption South Yorkshire, the area's regional adoption agency, said there are 33 children in sibling groups in need of a family. The agency said brothers and sisters tend to wait longer for an adoptive family. It said adopting a sibling group meant parents only had to go through the process once to complete their family. Stephanie Evans, head of One Adoption South Yorkshire, said: ""We're asking the people of South Yorkshire to consider keeping brothers and sisters together by giving them the loving, stable, permanent home they need."" She said there were lots of positives to adopting siblings. ""Children adopted together are more likely to settle into their new home quickly, develop key social skills like sharing, as well as nurturing their own identity and sibling bond. ""It also means you only have to go through the adoption process once to create your family."" She said the agency welcomed adopters from all backgrounds and said prospective parents are supported throughout the process. Ms Evans added said it was a ""huge decision"" for anyone. ""At times it is challenging, as parenthood is for everyone, but adoption is an incredibly rewarding and positive experience, and our team is always on hand to offer support and answer your questions."" Follow BBC Yorkshire on Facebook, X (formerly Twitter) and Instagram. Send your story ideas to yorkslincs.news@bbc.co.uk. Copyright 2024 BBC. All rights reserved.  The BBC is not responsible for the content of external sites. Read about our approach to external linking.  ",-2,-1,
BBCNews_50,"The US Supreme Court has agreed to hear a legal challenge that could undo hundreds of charges relating to the Capitol riot on 6 January 2021. On Wednesday, it said its justices would review the charge of obstruction of an official proceeding. Some 300 people have been charged with that statute for alleged crimes committed during the Capitol riot. Former President Donald Trump is also charged with that count in the federal investigation being led by Jack Smith. The top court's eventual decision could upend all of those charges and potentially delay the start of Mr Trump's trial on 4 March. The man who brought the appeal, Joseph Fischer, says the law has been applied incorrectly against people charged over their involvement in the riot.  Federal prosecutors say Mr Fischer was one of thousands who participated in the attack on Congress to prevent it from carrying out the certification of the 2020 election results. He claims that the law, which was created in the wake of an accounting scandal in 2002 to prevent corporate malfeasance during trials, has been unreasonably stretched to apply to those charged over the violence.  Lawyers for Mr Fischer say those who stormed the Capitol were not acting ""corruptly"" as the law demands. Instead, they say rioters were protesting what they honestly believed to be a stolen election.  But the justice department has argued that ""official proceeding"" could refer to a proceeding of Congress. The Supreme Court's decision to hear the matter could have consequences for Special Counsel Jack Smith's prosecution of Mr Trump for his alleged efforts to overturn the 2020 election results.  In August, Mr Smith charged the former president with obstruction of an official proceeding and three other federal crimes. Mr Trump pleaded not guilty to the charges and claimed he was the victim of a political ""witch hunt"".  Mr Fischer's attorneys' specifically noted the connection in their petition to the court. The case ""presents an important question of federal law affecting hundreds of prosecutions arising from January 6, including the prosecution of former President Donald Trump,"" they wrote. Earlier, a US District Court judge ruled in favour of Mr Fischer and two others charged in connection to the riot, but a subsequent appeals court voted 2-1 to overturn that ruling.  Appellate Judge Florence Pan wrote that the Justice Department's ""broad interpretation of the statute…is unambiguous and natural"". Her colleague, Judge Gregory Katsas, dissented, writing the government was ""mistaken"" and that its interpretation ""hard to reconcile"" with the history of the statute.  In September, Mr Fischer had asked the US Supreme Court to consider his case. The court agreed to hear it in a series of announcements on Wednesday, which also included a high-profile abortion pill case. Those following the federal Capitol riot investigation will be closely watching the Supreme Court as it weighs Mr Fischer's case. It marks the second 6 January-related case to come before the Supreme Court in recent days. On Monday, the justices agreed to hear arguments about whether Mr Trump could be prosecuted for crimes he allegedly committed during his presidency. US justices heard arguments about Trump's presidentially eligibility after Colorado disqualified him. Justices intensely questioned attorneys who argued he should be removed from Colorado's primary ballot. Conservatives hold a 6-3 majority on top court, which has the final word on highly contentious laws. On Thursday, the Supreme Court will hear the former president's appeal after Colorado ruled he couldn't run for president there. The former president loses a landmark legal bid to shield him from charges of election fraud. Copyright 2024 BBC. All rights reserved.  The BBC is not responsible for the content of external sites. Read about our approach to external linking.  ",1,2,
BBCNews_51,"The former finance secretary, Kate Forbes, has urged the Scottish government not to appeal a court decision to uphold the UK government's block on gender reform.  Ms Forbes said politicians should work to ""heal divisions not exacerbate them"".  She said a reformed bill should safeguard the rights of trans people as well as women and girls.  The Scottish government has three weeks to decide whether or not to appeal.  Writing on X, formerly Twitter, Ms Forbes said she urged the Scottish government ""not to prolong the legal battle further"" over the Gender Recognition (Reform) Bill.  She said: ""I previously argued that Scot Gov shouldn't contest S35 unless there was a v high chance of success.  ""A loss for Scot Gov would obvs absorb public funds but could also embolden future UK Govs to interfere in devolution, which no party of independence wishes to see."" She added that the legal process ""has created a period of great uncertainty and fear for trans people and women and girls, deepening already bitter divisions"". She also warned that losing an appeal at this stage could ""embolden"" future UK governments to ""interfere in devolution"". Her intervention comes a day after judges at the Court of Session in Edinburgh ruled that the UK government acted lawfully in blocking Scotland's gender self-ID reforms. The legislation, which is designed to make it easier for people to change their legally-recognised sex, was passed by the Scottish Parliament last year. The UK government blocked it from becoming law over fears it would impact on equality laws across the rest of the UK. Friday's Court of Session ruling rejected a Scottish government legal challenge to the veto. If the Scottish government now decides to appeal against the ruling, the case could ultimately end up in the Supreme Court in London. The legislation received cross-party support in Holyrood, passing by 86 votes to 39. Opponents of the reforms warned the legislation could risk the safety of women and girls in same-sex spaces such as hospital wards and refuges. Supporters argued it would make the process of obtaining a gender recognition certificate (GRC) easier and less traumatic for trans people. Ms Forbes came a close second in the SNP leadership contest after the resignation of Nicola Sturgeon earlier this year. A member of the Free Church of Scotland, she has spoken of experiencing a backlash against her religious views. She has previously said she would not have voted for the Scottish government's gender reform bill in its current form. In February she told BBC Scotland she had ""significant concerns"" about gender self-identification. In response to interview questions during her campaign, she said the idea of having children outside of marriage conflicted with her Christian faith and confirmed that she was anti-abortion. Ms Forbes also said she would not have voted for same-sex marriage if she had been a politician in 2014 when the law passed. The Gender Recognition (Reform) Bill is a central part of the Bute House Agreement, which brought Green co-leaders Patrick Harvie and Lorna Slater into government with the SNP as ministers. The Green MSP Maggie Chapman told the BBC she believed the Scottish government ought to appeal Friday's ruling to protect both devolution and the rights of trans people. ""Getting reform of the Gender Recognition Act through the Scottish Parliament is a cornerstone of the Bute House Agreement that the Scottish Greens have with the Scottish government,"" she said. ""But it is really, really important that we give all seven MSPs, the wider Green Party membership as well, the opportunity to have contributions to the conversation."" The party wants another debate on the conflict, after a vote on Wednesday descended into chaos. Freedom of speech jostles with safety concerns as MPs weigh up the complexities of the Israel-Gaza conflict. Tory and SNP MPs call for a confidence vote on Sir Lindsay Hoyle amid a row over his position. SNP Westminster leader Stephen Flynn says the Speaker has lost his party's confidence and can not carry on. Sir Lindsay Hoyle is facing growing criticism over granting a vote on a Labour ceasefire motion. Copyright 2024 BBC. All rights reserved.  The BBC is not responsible for the content of external sites. Read about our approach to external linking.  ",1,1,
