File_Name,Text_Content,Annotator_1,Annotator_2,Annotator_3
BBCNews_1,"Pope Francis is evicting US Cardinal Raymond Burke, an outspoken critic, from his Vatican apartment and revoking his salary. Cardinal Burke is part of a group of American conservatives who have long opposed the Pope's plans for reforming the Catholic Church. A Vatican source told the BBC that Pope Francis has not yet carried out his intention to evict the 75-year-old. And the decision is not meant as a personal punishment, the source added. Instead, it comes from the belief that a person should not enjoy cardinal privileges while criticising the head of the church. Still, the move is ""unprecedented in the Francis era"", Christopher White, a Vatican observer who writes for the National Catholic Reporter, told the BBC. ""Typically, retired cardinals continue to reside in Rome after stepping down from their positions, often remaining active in papal liturgies and ceremonial duties,"" he said. ""Evicting someone from their Vatican apartment sets a new precedent."" Mr White warned that the decision could ""provoke significant backlash"" and deepen divides between the Vatican and the US church, where there is already ""fragmentation"".  Cardinal Burke has yet to respond to the news and the BBC has reached out to his office for comment. The Pope revealed his plan to act against the cardinal at a meeting with heads of Vatican offices last week. His frustration with US detractors who take a more traditional or conservative view on several issues appears to be coming to a boil. Earlier this month, he fired Joseph Strickland, a conservative Texas bishop who had blasted his attempts to move the church to more liberal positions on abortion, transgender rights and same-sex marriage. The removal followed a church investigation into governance of the diocese. A few months before, the Pope told members of the Jesuit religious order in Portugal that there was ""a very strong, organised, reactionary attitude in the US church"", which he called ""backward"", according to the Guardian. Tensions with Cardinal Burke, who was appointed by Pope Benedict XVI, have been simmering for nearly a decade, with the American prelate openly criticising Pope Francis over both social and liturgical issues.  ""Cardinal Burke's situation seems to stem from his gradual alienation from the Pope,"" said Mr White. ""It appears the Pope perceives Burke as fostering a cult of personality, centred around traditionalism or regressive ideals. This action seems aimed at limiting Burke's influence by severing his ties to Rome."" Most recently, the cardinal held a conference called The Synodal Babel in Rome on the eve of the Pope's synod, or meeting of bishops, last month.  He also joined fellow conservatives in publishing a ""declaration of truths"" in 2019 that described the Catholic church as disoriented and confused under Pope Francis, saying that it had moved away from core teachings on divorce, contraception, homosexuality and gender.  Notably, he disagreed with the Pope promoting Covid vaccines. Within church politics, he and Pope Francis were at odds over the firing of the head of the Knights of Malta after the order's charity branch was found to have distributed condoms in Myanmar. The Pope, in turn, has demoted Cardinal Burke within the church hierarchy or moved him to posts with less influence over the years. Michael Matt, a columnist for the right-wing Catholic newspaper The Remnant, wrote that the most recent action taken against Cardinal Burke showed that Pope Francis was ""cancelling faithful prelates who offer hierarchical cover to pro-life, pro-family, pro-tradition hardliners"". He accused the Pope of putting critics into ""forced isolation"".  The man who burned himself in Washington DC is an active-duty US airman, local media report. After Alabama rules that frozen embryos are children, some fertility patients pray that lawmakers find a solution. The former president moves closer to the Republican nomination with a huge win in his rival's home state. The US says the allies targeted 18 sites, including missile storages, drones and radars. As Kristi Noem and Vivek Ramaswamy top a straw poll of conservative activists, we assess all the pitches. Copyright 2024 BBC. All rights reserved.  The BBC is not responsible for the content of external sites. Read about our approach to external linking.  ",2,,2
BBCNews_2,"Chileans are voting in a referendum to decide whether to adopt a new constitution to replace the one brought in under Gen Augusto Pinochet.  A previous draft put forward by an elected body dominated by left-wing delegates was rejected last year.  A constitutional council, this time dominated by right-wing delegates, has drafted a new, more conservative version. But polls suggest Chileans remain divided on whether to approve it. The drive for a new constitution started in 2019 after massive anti-government protests rocked Chile, which is normally seen as a haven of stability in the region. The protesters, many of whom were left-wing students, demanded drastic social and political change. After months of disruption, the conservative president at the time, Sebastián Piñera, agreed to launch a process to rewrite the 1980 constitution. But the first draft, crafted by a constitutional convention chosen by voters, proved too radical for many. Many balked at its sweeping reforms and its proposals to change many of the country's established institutions, such as replacing the 200-year-old Senate with a new Chamber of Regions. It also proposed declaring Chile a ""plurinational state"", recognising the rights of Chile's indigenous groups - which make up about 13% of the population - to their lands and resources. In September 2022 it was rejected by 62% of voters. A new constitutional council - this time made up of 24 individuals designated by Congress and 51 representatives elected by the Chilean people - was created to come up with a new draft.  It is this revised draft which Chileans have been asked to approve or reject this Sunday.  Opinion polls suggest that this second draft may also fail to get the backing necessary for it to come into force, with 46% telling pollsters they plan to vote against the draft and only 38% saying they will back it, with 16% still undecided. While the first draft was widely criticised for being ""too far-left"", some voters have said that this second draft has veered too far to the right.  Socialist Party Senator Paulina Vodanovic warned that the new text represented ""a move backwards"" on many aspects of Chilean social and political life, such as gender issues. Other leftist critics argue that the revised proposal fails to adequately protect indigenous rights. On the issue of abortion, for example, left-wing critics deem the proposed text too ambiguous and say it could allow future restrictions on existing reproductive rights.  Left-wing critics also dislike the weight given to private property rights and the fact that the new text enshrines private sector participation in the provision of basic services such as health, education or pensions. Some describe it as being more conservative than the current constitution it aims to replace.  Proponents of the new draft say it gives individuals more choice by letting them decide if they prefer public or private providers for basic services. Natalia González, a member of the constitutional council, wrote on X, formerly Twitter: ""If the state does it well, then they [the Chilean people] can opt for it, but if not, people don't have to remain captive. That freedom is protected in the new constitution."" The far-right Republican party, which holds a majority of the seats on the constitutional council, is backing the new draft.  The party's leader and former presidential candidate, José Antonio Kast, urged ""us Chileans who last year voted 'reject', now have to vote in favour, in favour of change, in favour of improvement"". The government of President Gabriel Boric, the left-wing former student leader who beat Mr Kast in 2021, has been accused by the opposition of openly promoting the ""reject"" option.  President Boric has already said that if the new draft is rejected, he will not push for another rewrite.  In that case, the current constitution will remain in place, although amendments and changes could be proposed.  Copyright 2024 BBC. All rights reserved.  The BBC is not responsible for the content of external sites. Read about our approach to external linking.  ",0,,1
BBCNews_3,"Medical providers and fertility patients in Alabama have been left in uncertainty after a court ruled that frozen embryos are considered children. At least three fertility facilities have since paused new IVF treatments over concerns of ""legal risk"". ""There is an emotional side to this, and I don't think the law should be based on those emotions,"" one Alabama mother said. The ruling opens up a new front in the US battle over reproductive medicine. It is not yet clear what the impact might be in other parts of the country.  The Alabama Supreme Court ruling, which came down on Friday, was prompted by three couples who filed a case after their embryos were accidentally destroyed in an incident in 2020. A patient wandered into the part of a fertility clinic where the embryos being stored, handled them, and accidentally dropped them.  The ruling did not ban or restrict IVF and in fact, the couples who brought the case actively sought out the procedure. But experts say the decision may cause confusion about whether some aspects of IVF are legal under Alabama law - and over how to use and store embryos. President Joe Biden weighed in on Alabama's decision, saying it puts ""some fertility treatments at risk for families who are desperately trying to get pregnant"".  ""The disregard for women's ability to make these decisions for themselves and their families is outrageous and unacceptable,"" he said in a statement. ""This is a direct result of the overturning of Roe v Wade."" Alabama Fertility, the largest clinic in the state, announced in a Facebook post on Thursday its ""impossibly difficult decision to hold new IVF treatments due to the legal risk to our clinic and our embryologists"".  It said it was contacting affected patients ""to find solutions"", and would alert legislators ""as to the far reaching negative impact of this ruling on the women of Alabama"".  Another clinic, Mobile Infirmary, announced it would be pausing treatments as well, saying the court decision ""sadly left us with no choice"". ""We understand the burden this places on deserving families who want to bring babies into this world and who have no alternative options for conceiving,"" said Mark Nix, president and of Infirmary Health.  It comes after the southern US state's largest hospital stated on Wednesday its own decision to pause IVF services, over fears it could be exposed to criminal prosecution.  Dr Mamie McLean from Alabama Fertility told the BBC World Service Newshour programme that her patients would not be able to go through IVF in the near future. She said the court ruling made it ""impossible"" for IVF treatments to happen in the state, adding that ""there will be fewer babies in Alabama because of this"". She pointed out that Alabama already had one of the lowest net population growths in the nation. Dr McLean explained: ""If an embryo is considered a child, the legal ramifications are too far-reaching and scary. We cannot put our practice or our embryology team at the risk of significant legal penalty or even jail time. And unfortunately, our patients are bearing the burden of this misguided ruling."" IVF patients are also concerned about the ruling's ramifications.  Veronica Wehby-Upchurch, 42, told the BBC that she had her son - now three years old - via IVF and has two frozen embryos in the state.  Since the ruling, though, she fears prosecution. Because she already went through IVF before, she says that while she was ""appalled"" at the news, she was ""unfortunately, not shocked"", adding that ""those of us who have been paying attention sort of saw this coming"".  Ms Wehby-Upchurch says her desire is to have another child but she does not know now what her options are and, at 42, there's not a lot of time left.  ""I understand the idea of attaching emotions to embryos,"" she said. ""But you can't cuddle an embryo, you can't breastfeed an embryo. It took me five embryos to get to my one child I hold in my arms."" IVF - which stands for in-vitro fertilisation - offers a possible solution to women who face challenges getting pregnant. Officials say around 2% of US pregnancies are the result of this method. The process involves retrieving the woman's eggs with a needle from her ovaries and combining them with a man's sperm in a lab. The fertilised embryo is then transferred into the woman's uterus, where it may create a pregnancy. After Alabama rules that frozen embryos are children, some fertility patients pray that lawmakers find a solution. Several clinics paused treatment after a court ruled frozen embryos have the same rights as children. The case stems from a lawsuit brought by three couples whose frozen embryos were lost at a clinic. The state recently executed Kenneth Eugene Smith with the controversial method condemned by the UN. Dr Mathew Knowles says his daughter was inspired by her grandfather's favourite country music as a child. Copyright 2024 BBC. All rights reserved.  The BBC is not responsible for the content of external sites. Read about our approach to external linking.  ",4,,1
BBCNews_4,"You probably shouldn't play Kim Petras's new EP to your mum. Titled Slut Pop Miami, it's an outrageous, sex-positive, club-ready tribute to the joys of carnal pleasure. Released on Valentines' Day, it was inspired by ""hedonistic trips to Miami"" and joins a lineage of explicit, transgressive pop, from Madonna's Erotica to Cardi B and Megan Thee Stallion's WAP. ""Stirring up the culture and raising eyebrows has been in the DNA of pop forever,"" Petras tells the BBC. The EP is the German-born star's third release since last June, following her debut album Feed The Beast and Problématique, a surprise release of an earlier, scrapped project. This flurry of activity followed her appearance on Sam Smith's global chart-topper Unholy - which made Petras the first openly transgender artist to have a US number one and the first trans artist to win a major category Grammy.  Her mainstream breakout followed years of hard graft. Petras started uploading cover songs to MySpace in 2007, and later gambled on a move to Los Angeles in the hope of becoming a pop star. ""I played every gay club in America, I danced on every single bar and I built my following from the ground up,"" she says.  ""I didn't have my breakthrough until Unholy but, to get to that stage, I had to release multiple songs as an independent artist and prove to record labels that there's a fanbase out there for me."" That determination paid off. Now signed to Republic Records (home to Taylor Swift and Ariana Grande), she's in the middle of a sold-out, 40-date world tour.  On a rare day off, Petras called the BBC to reflect on her career to date. Hey Kim! Are we interrupting your vocal rest? Not today, I have a bunch of things lined up. But usually, between shows, I just shut up for two whole days. It's the only thing that works for singers who actually sing. Ah yes, you have a policy of never miming. How come? I just feel ripped off if I go to a show and the artist isn't singing. When you sing live, it makes the show different every night. Your performance reflects the energy of the crowd. If they're into it, you're going to hit all the high notes and do all the crazy runs. And knowing that gives the fans motivation to go crazy as well. It helps that you have a really strong voice... Well, I've always been really loud! I used to get in trouble with my neighbours because I love diva singers like Freddie Mercury or Cher, so it felt right for me to sing big. How did you train yourself to emulate Cher? Well, at first, you blow out your voice a bunch, until you realise you're screaming and doing it wrong. I used to sing from my throat a lot - for us Germans the ""R"" sounds are in our throats. Then you adjust and learn to sing from your body, not your throat.  But thank God, I had a voice to work with in the beginning. My parents taught me a lot, too. My dad's an architect, but he plays eight instruments and was always off to band rehearsals. And my mum was really into jazz, so there was a lot of Billie Holiday in the house. It's nice to hear that. So many interviews about your childhood focus on your gender transition, but music was always important? Absolutely. I was always singing. Music was my happy place and honestly very helpful in my transition. I went through that stuff very early [Petras completed gender reassignment surgery at 16] and music allowed me to sing and twirl and forget about how the world reacted to me. Once I started learning how to write, it immediately became my job. I figured, OK, you live in the middle of nowhere, no-one's going to write songs for you, so you'd better learn to do it yourself.  I wanted to be like an Indiana Jones of music and find the magic formula to pop. Does that explain why your songs are so upbeat and escapist, even now? Totally. I think there's a double standard in music where the stuff that gets taken seriously is sad and depressed, because those emotions are so hard. But a lot of the time, I feel very depressed and the way to get myself out of it is to write a ridiculous song. If I write a sad one, it's just going to make me sadder.  So, for me, making happy songs, or slutty songs, takes just as much effort as writing a slow ballad. Just because it doesn't seem like there's any hurt or pain going into the creation of that, it doesn't mean it's not there. Can you imagine a time where you would write about the things you went through as a teenager?  I try to stay away from the past. I find the past quite useless. I'm more focused on new and exciting things. But yeah, I definitely feel like, after releasing so many different projects, I need to go down new routes. Maybe it would be more about the stuff I'm currently going through, rather than the past. The lyrics on Slut Pop aren't especially deep, but the idea of relishing and celebrating sex still feels quite radical in pop. Why do you think that is?  It's something I feel strongly about. I've always been surrounded by incredible women. Even at school, the people who stood up for me and understood my condition were female. And I think men's desire to control women's bodies has been the plague of this planet forever. It very much goes hand in hand with being transgender. The people who wanted to forbid me to transition are the same ones who want to forbid women to have abortions or have sex and even make money from it. I'm a big fan of Madonna's work, and I feel like, when she celebrated sex in Erotica and her Sex book, people misunderstood it as just filth. But female sexuality isn't filth, and it shouldn't be written off like that. Neither is trans-feminine sexuality or anyone's sexuality. I think everybody should be equal. That's not to say Slut Pop is a big political statement. It's supposed to just be fun, but the conversation it stirs up is a good thing. A lot of the Slut Pop songs have blown up on TikTok. What are your thoughts on Universal Music removing music, including yours, from the app while they argue over royalty payments? I feel very protected by Universal. I know people who have number one records and can't afford their rent, so I'm proud Universal is taking a stand. Of course, right now, all of us Universal artists are screwed a little bit, but you've gotta take one for the team. The intentions are noble. It's about musicians making money from their art - and not just the famous faces, but the songwriters and the people behind the scenes. I feel like it's a really good fight. When royalty payments are so low, do you ever think about going back to your first job and writing advertising jingles? Me and my friends still make jingles all the time, just for fun. And if I ever had a stroke of genius and came up with something where I'm like, 'This has laundry detergent written all over it', then, for sure, I'm not above it. And about the money thing: I know what it's like to struggle and be a songwriter who lives on a studio couch and goes a year without getting any songs released but, at the end of the day, as long as I can write music, I'm happy. The money part is really for my fans. I want to put on the best show for them.  You're opening the Euro 2024 football tournament this summer. What can you tell us about that? I'm over the moon about it. Soccer is such a big part of German culture, so it feels like a huge deal. I have so many memories of watching matches with my friends and getting absolutely hammered, so it's gonna be crazy! Plus, the opening match is Germany v Scotland, so there'll be a lot of kilts in the stadium. Oh my God, that's my dream. It is America's first federal trial over an an alleged hate crime based on gender identity. First broadcast 25 years ago, Queer as Folk depicted three gay men in a way not seen on TV before. Festival organisers say they won't host the 2024 event to allow it to ""flourish and evolve"". The presenter is taking over from DJ Ace, who left the the station after 21 years. Jan Latham-Koenig was caught out in an operation involving a police officer posing as a child. Copyright 2024 BBC. All rights reserved.  The BBC is not responsible for the content of external sites. Read about our approach to external linking.  ",2,,2
